{
  "$schema": "https://json-schema.org/draft/2020-12/schema",
  "title": "CharacterRegistry",
  "description": "Editable versioned character registry for one book.",
  "type": "object",
  "properties": {
    "book_id": {
      "description": "Identity shared by all chapters.",
      "$ref": "#/$defs/BookId"
    },
    "characters": {
      "description": "Characters with unique IDs, but potentially shared names.",
      "type": "array",
      "items": {
        "$ref": "#/$defs/Character"
      }
    },
    "extensions": {
      "description": "Application-specific additions.",
      "type": "object",
      "additionalProperties": true
    },
    "format_version": {
      "description": "Only draft format 1 is supported.",
      "type": "integer",
      "format": "uint32",
      "maximum": 1,
      "minimum": 1
    },
    "revision": {
      "description": "Positive character revision referenced by annotations.",
      "type": "integer",
      "format": "uint64",
      "minimum": 1
    }
  },
  "additionalProperties": false,
  "required": [
    "format_version",
    "book_id",
    "revision",
    "characters"
  ],
  "$defs": {
    "BookId": {
      "description": "Opaque book identity, separate from a title.",
      "type": "string",
      "minLength": 1,
      "pattern": "\\S"
    },
    "ChapterId": {
      "description": "Opaque chapter identity, separate from ordering.",
      "type": "string",
      "minLength": 1,
      "pattern": "\\S"
    },
    "Character": {
      "description": "An editable draft character record, untrusted until book validation.",
      "type": "object",
      "properties": {
        "aliases": {
          "description": "Other names; the same alias can refer to multiple identities.",
          "type": "array",
          "items": {
            "type": "string"
          }
        },
        "display_name": {
          "description": "Current display name; need not be unique.",
          "type": "string"
        },
        "evidence": {
          "description": "Evidence of this character in supplied chapters.",
          "type": "array",
          "items": {
            "$ref": "#/$defs/EvidenceRef"
          }
        },
        "extensions": {
          "description": "Application-specific additions.",
          "type": "object",
          "additionalProperties": true
        },
        "id": {
          "description": "Stable identity.",
          "$ref": "#/$defs/CharacterId"
        },
        "review_status": {
          "description": "Human confirmation state.",
          "$ref": "#/$defs/ReviewStatus"
        },
        "voice_profile": {
          "description": "Optional semantic description.",
          "anyOf": [
            {
              "$ref": "#/$defs/VoiceProfile"
            },
            {
              "type": "null"
            }
          ]
        }
      },
      "additionalProperties": false,
      "required": [
        "id",
        "display_name",
        "aliases",
        "review_status",
        "evidence"
      ]
    },
    "CharacterId": {
      "description": "Stable character identity, separate from names and voices.",
      "type": "string",
      "minLength": 1,
      "pattern": "\\S"
    },
    "EvidenceRef": {
      "description": "Reference to a segment in an explicitly supplied chapter.",
      "type": "object",
      "properties": {
        "chapter_id": {
          "description": "Chapter containing the evidence.",
          "$ref": "#/$defs/ChapterId"
        },
        "segment_id": {
          "description": "Evidence segment within that chapter.",
          "$ref": "#/$defs/SegmentId"
        }
      },
      "additionalProperties": false,
      "required": [
        "chapter_id",
        "segment_id"
      ]
    },
    "ReviewStatus": {
      "description": "Human review, independent of whether attribution is resolved.",
      "oneOf": [
        {
          "description": "Not yet confirmed by a human.",
          "type": "string",
          "const": "unreviewed"
        },
        {
          "description": "Confirmed by a human; future model workflows must protect corrections.",
          "type": "string",
          "const": "confirmed"
        }
      ]
    },
    "SegmentId": {
      "description": "Opaque segment identity within one source version.",
      "type": "string",
      "minLength": 1,
      "pattern": "\\S"
    },
    "VoiceProfile": {
      "description": "Optional draft semantic voice description; contains no backend voice IDs.",
      "type": "object",
      "properties": {
        "age_band": {
          "description": "Evidence-grounded age description, absent or `unknown` if unspecified.",
          "type": [
            "string",
            "null"
          ]
        },
        "evidence": {
          "description": "Evidence supporting non-unknown profile claims.",
          "type": "array",
          "default": [],
          "items": {
            "$ref": "#/$defs/EvidenceRef"
          }
        },
        "gender": {
          "description": "Evidence-grounded description, absent or `unknown` if unspecified.",
          "type": [
            "string",
            "null"
          ]
        },
        "impressions": {
          "description": "Free-text semantic impressions, not synthesis parameters.",
          "type": "array",
          "default": [],
          "items": {
            "type": "string"
          }
        }
      },
      "additionalProperties": false
    }
  }
}