{
  "format_version": 1,
  "book_id": "same_name-02",
  "revision": 1,
  "characters": [
    {
      "id": "teacher",
      "display_name": "周宁",
      "aliases": [
        "老师周宁"
      ],
      "review_status": "unreviewed",
      "evidence": [
        {
          "chapter_id": "ch-001",
          "segment_id": "seg-001"
        }
      ]
    },
    {
      "id": "student",
      "display_name": "周宁",
      "aliases": [
        "学生周宁"
      ],
      "review_status": "unreviewed",
      "evidence": [
        {
          "chapter_id": "ch-001",
          "segment_id": "seg-001"
        },
        {
          "chapter_id": "ch-001",
          "segment_id": "seg-003"
        }
      ]
    }
  ]
}
