{
  "format_version": 1,
  "book_id": "same_name-04",
  "revision": 1,
  "characters": [
    {
      "id": "tian1",
      "display_name": "小田",
      "aliases": [],
      "review_status": "unreviewed",
      "evidence": [
        {
          "chapter_id": "ch-001",
          "segment_id": "seg-001"
        }
      ]
    },
    {
      "id": "tian2",
      "display_name": "小田",
      "aliases": [],
      "review_status": "unreviewed",
      "evidence": [
        {
          "chapter_id": "ch-001",
          "segment_id": "seg-001"
        }
      ]
    }
  ]
}
