{
  "format_version": 1,
  "book_id": "candidates-04",
  "revision": 1,
  "characters": [
    {
      "id": "worker",
      "display_name": "戴帽子的工人",
      "aliases": [],
      "review_status": "unreviewed",
      "evidence": [
        {
          "chapter_id": "ch-001",
          "segment_id": "seg-001"
        }
      ]
    },
    {
      "id": "cook",
      "display_name": "穿围裙的厨师",
      "aliases": [],
      "review_status": "unreviewed",
      "evidence": [
        {
          "chapter_id": "ch-001",
          "segment_id": "seg-001"
        }
      ]
    }
  ]
}
