{
  "format_version": 1,
  "book_id": "explicit-04",
  "revision": 1,
  "characters": [
    {
      "id": "tao",
      "display_name": "陶宁",
      "aliases": [],
      "review_status": "unreviewed",
      "evidence": [
        {
          "chapter_id": "ch-001",
          "segment_id": "seg-003"
        }
      ]
    }
  ]
}
