{
  "format_version": 1,
  "book_id": "anonymous-02",
  "revision": 1,
  "characters": [
    {
      "id": "traveler",
      "display_name": "红衣旅客",
      "aliases": [],
      "review_status": "unreviewed",
      "evidence": [
        {
          "chapter_id": "ch-001",
          "segment_id": "seg-001"
        },
        {
          "chapter_id": "ch-001",
          "segment_id": "seg-003"
        }
      ]
    }
  ]
}
