{
  "format_version": 1,
  "book_id": "unowned-04",
  "revision": 1,
  "characters": [
    {
      "id": "han",
      "display_name": "韩梅",
      "aliases": [],
      "review_status": "unreviewed",
      "evidence": [
        {
          "chapter_id": "ch-001",
          "segment_id": "seg-001"
        }
      ]
    },
    {
      "id": "shi",
      "display_name": "石桥",
      "aliases": [],
      "review_status": "unreviewed",
      "evidence": [
        {
          "chapter_id": "ch-001",
          "segment_id": "seg-001"
        }
      ]
    }
  ]
}
