{
  "format_version": 1,
  "book_id": "ambiguous",
  "revision": 1,
  "characters": [
    {
      "id": "zhang-a",
      "display_name": "老张",
      "aliases": [
        "张师傅"
      ],
      "review_status": "unreviewed",
      "evidence": [
        {
          "chapter_id": "ch-001",
          "segment_id": "seg-001"
        }
      ]
    },
    {
      "id": "zhang-b",
      "display_name": "老张",
      "aliases": [
        "张师傅"
      ],
      "review_status": "unreviewed",
      "evidence": [
        {
          "chapter_id": "ch-001",
          "segment_id": "seg-001"
        }
      ]
    }
  ]
}
